{
 "id": "arxiv:1306.0978",
 "title": "Complex Lines with Restricted Angles",
 "authors": [
  "Aidan Roy"
 ],
 "year": 2013,
 "listing": "arxiv",
 "links": {
  "arxiv": "https://arxiv.org/abs/1306.0978"
 },
 "formalisations": [
  {
   "repository": "JD-Jones-ASES/finite-quantum-designs-lean",
   "commit": "5938504ecc632f9101d5ef17603879a08dad3866",
   "stated_by": {
    "source": "formalization.yaml",
    "file": "formalization.yaml"
   },
   "review_status": "self-assessed"
  }
 ]
}
