{
 "id": "arxiv:0801.0805",
 "title": "One curious proof of Fermat's little theorem",
 "authors": [
  "Giedrius Alkauskas"
 ],
 "year": 2008,
 "listing": "arxiv",
 "links": {
  "arxiv": "https://arxiv.org/abs/0801.0805"
 },
 "formalisations": [
  {
   "repository": "seewoo5/DifferentProofs",
   "commit": "86c1f0544b31ba33b96f15d4e7e465198d86c7f1",
   "stated_by": {
    "source": "formalization.yaml",
    "file": "formalization.yaml"
   },
   "review_status": "self-assessed"
  }
 ]
}
