{
 "id": "arxiv:2606.15394",
 "title": "Dominant Zeros of Nekrasov--Okounkov Polynomials",
 "authors": [
  "Bernhard Heim",
  "Markus Neuhauser",
  "with an appendix by Ken Ono"
 ],
 "year": 2026,
 "listing": "arxiv",
 "links": {
  "arxiv": "https://arxiv.org/abs/2606.15394"
 },
 "formalisations": [
  {
   "repository": "AxiomMath/challenge_3",
   "commit": "906bf345908100af358c60f9336f27dc571d21ac",
   "stated_by": {
    "source": "formalization.yaml",
    "file": "formalization.yaml"
   },
   "review_status": "author-verified"
  }
 ]
}
