{
 "id": "arxiv:2609.21892",
 "title": "Real quadratic fields and finite quantum dilogarithms I",
 "authors": [
  "Danylo Radchenko",
  "Campbell Wheeler"
 ],
 "year": 2026,
 "listing": "arxiv",
 "links": {
  "arxiv": "https://arxiv.org/abs/2609.21892"
 },
 "formalisations": [
  {
   "repository": "marozols/SIC-existence",
   "commit": "91e3a438beb8dd4f580fd56195479981f0db49bd",
   "stated_by": {
    "source": "formalization.yaml",
    "file": "formalization.yaml"
   },
   "review_status": "self-assessed"
  }
 ]
}
