{
 "id": "arxiv:2311.05762",
 "title": "On a conjecture of Marton",
 "authors": [
  "W. T. Gowers",
  "Ben Green",
  "Freddie Manners",
  "Terence Tao"
 ],
 "year": 2023,
 "listing": "arxiv",
 "links": {
  "arxiv": "https://arxiv.org/abs/2311.05762"
 },
 "formalisations": [
  {
   "repository": "teorth/pfr",
   "commit": "61bbfc446a44a9cc4f3d54668fd909a824142e4b",
   "stated_by": {
    "source": "formalization.yaml",
    "file": "formalization.yaml"
   },
   "review_status": "self-assessed"
  }
 ]
}
