{
 "id": "arxiv:2103.06624",
 "title": "Beta-CROWN: Efficient Bound Propagation with Per-neuron Split Constraints for Complete and Incomplete Neural Network Robustness Verification",
 "authors": [
  "Shiqi Wang",
  "Huan Zhang",
  "Kaidi Xu",
  "Xue Lin",
  "Suman Jana",
  "Cho-Jui Hsieh",
  "J. Zico Kolter"
 ],
 "year": 2021,
 "listing": "arxiv",
 "links": {
  "arxiv": "https://arxiv.org/abs/2103.06624"
 },
 "formalisations": [
  {
   "repository": "AIQ-Kitware/aiq-veristressgt-formalization",
   "commit": "9cee3d9ebfcb42e9a7d7220683eb4969a2b3b31b",
   "stated_by": {
    "source": "formalization.yaml",
    "file": "formalization.yaml"
   }
  }
 ]
}
