{
 "id": "arxiv:2408.02151",
 "title": "Periodicity and decidability of translational tilings by rational polygonal sets",
 "authors": [
  "Jaume de Dios Pont",
  "Jan Grebík",
  "Rachel Greenfeld",
  "Jose Madrid"
 ],
 "year": 2024,
 "listing": "arxiv",
 "links": {
  "arxiv": "https://arxiv.org/abs/2408.02151"
 },
 "formalisations": [
  {
   "repository": "jaumededios/Tiling",
   "commit": "00f80c7de5acfef590c40ad20384b7df250faffb",
   "stated_by": {
    "source": "formalization.yaml",
    "file": "formalization.yaml"
   },
   "review_status": "agent-reviewed"
  }
 ]
}
