{
 "id": "arxiv:2006.04710",
 "title": "The Lipschitz Constant of Self-Attention",
 "authors": [
  "Hyunjik Kim",
  "George Papamakarios",
  "Andriy Mnih"
 ],
 "year": 2020,
 "listing": "arxiv",
 "links": {
  "arxiv": "https://arxiv.org/abs/2006.04710"
 },
 "formalisations": [
  {
   "repository": "AIQ-Kitware/aiq-veristressgt-formalization",
   "commit": "9cee3d9ebfcb42e9a7d7220683eb4969a2b3b31b",
   "stated_by": {
    "source": "formalization.yaml",
    "file": "formalization.yaml"
   }
  }
 ]
}
