{
 "id": "arxiv:2001.06005",
 "title": "Elements of Scheduling",
 "authors": [
  "Jan Karel Lenstra",
  "David B. Shmoys"
 ],
 "year": 2020,
 "listing": "arxiv",
 "links": {
  "arxiv": "https://arxiv.org/abs/2001.06005"
 },
 "formalisations": [
  {
   "repository": "JD-Jones-ASES/graham-lpt-lean",
   "commit": "8daf75ad729e6eebbd5d5cce5d3b0884316eef80",
   "stated_by": {
    "source": "formalization.yaml",
    "file": "formalization.yaml"
   },
   "review_status": "self-assessed"
  }
 ]
}
