{
 "id": "arxiv:2608.00323",
 "title": "On a conjecture of Han and Xiong for fractional Gaussian binomial coefficients",
 "authors": [
  "Ken Ono"
 ],
 "year": 2026,
 "listing": "arxiv",
 "links": {
  "arxiv": "https://arxiv.org/abs/2608.00323"
 },
 "formalisations": [
  {
   "repository": "AxiomMath/QBinomialTrace",
   "commit": "10860052a362c23a777e84da04bde9f4184cd227",
   "stated_by": {
    "source": "formalization.yaml",
    "file": "formalization.yaml"
   },
   "review_status": "author-verified"
  }
 ]
}
