{
 "id": "arxiv:0909.4994",
 "title": "A remarkable family of left ordered groups: central extensions of Hecke groups",
 "authors": [
  "Andrés Navas"
 ],
 "year": 2009,
 "listing": "arxiv",
 "links": {
  "arxiv": "https://arxiv.org/abs/0909.4994"
 },
 "formalisations": [
  {
   "repository": "homeowmorphism/finitely-generated-positive-cones-in-fnz",
   "commit": "20bfd7cb2abb773f2426af11cd0217b415f7497b",
   "stated_by": {
    "source": "formalization.yaml",
    "file": "formalization.yaml"
   },
   "review_status": "agent-reviewed"
  }
 ]
}
