{
 "id": "arxiv:2104.06756",
 "title": "A Survey of the Hadamard Maximal Determinant Problem",
 "authors": [
  "Patrick Browne",
  "Ronan Egan",
  "Fintan Hegarty",
  "Padraig O Cathain"
 ],
 "year": 2021,
 "listing": "arxiv",
 "links": {
  "arxiv": "https://arxiv.org/abs/2104.06756"
 },
 "formalisations": [
  {
   "repository": "mattppal/ehlich-wojtas",
   "commit": "65580f5606f9330e38545a18ecb08772c77f9142",
   "stated_by": {
    "source": "formalization.yaml",
    "file": "formalization.yaml"
   },
   "review_status": "self-assessed"
  }
 ]
}
