{
 "id": "arxiv:2601.14411",
 "title": "A streamlined proof of the Kakeya set conjecture in $\\mathbb{R}^3$",
 "authors": [
  "Larry Guth",
  "Hong Wang",
  "Joshua Zahl"
 ],
 "year": 2026,
 "listing": "arxiv",
 "links": {
  "arxiv": "https://arxiv.org/abs/2601.14411"
 },
 "formalisations": [
  {
   "repository": "project-numina/kakeya-3d",
   "commit": "a26427e3c2fcaf9f98694fbd0d4dd49e41dcf5e3",
   "stated_by": {
    "source": "formalization.yaml",
    "file": "formalization.yaml"
   },
   "review_status": "self-assessed"
  }
 ]
}
