{
 "id": "arxiv:2309.08184",
 "title": "On the first two eigenvalues of regular graphs",
 "authors": [
  "Shengtong Zhang"
 ],
 "year": 2023,
 "listing": "arxiv",
 "links": {
  "arxiv": "https://arxiv.org/abs/2309.08184"
 },
 "formalisations": [
  {
   "repository": "mattppal/zhang-lemma-2-2",
   "commit": "95a66e6cd04162de82e8f790df20c58645690a29",
   "stated_by": {
    "source": "formalization.yaml",
    "file": "formalization.yaml"
   },
   "review_status": "unchecked"
  }
 ]
}
