{
 "id": "arxiv:1004.5183",
 "title": "List Coloring and $n$-monophilic graphs",
 "authors": [
  "Radoslav Kirov",
  "Ramin Naimi"
 ],
 "year": 2010,
 "listing": "arxiv",
 "links": {
  "arxiv": "https://arxiv.org/abs/1004.5183"
 },
 "formalisations": [
  {
   "repository": "rkirov/enumerative-chromatic-choosability",
   "commit": "05c1a41281907c8c6a892b5f4c6efe0b7c5bf523",
   "stated_by": {
    "source": "formalization.yaml",
    "file": "formalization.yaml"
   },
   "review_status": "agent-reviewed"
  }
 ]
}
